<?xml version="1.0" encoding="UTF-8"?>
<!--

    Copyright (c) 2014 mgm technology partners GmbH

    Licensed under the Apache License, Version 2.0 (the "License");
    you may not use this file except in compliance with the License.
    You may obtain a copy of the License at

        http://www.apache.org/licenses/LICENSE-2.0

    Unless required by applicable law or agreed to in writing, software
    distributed under the License is distributed on an "AS IS" BASIS,
    WITHOUT WARRANTIES OR CONDITIONS OF ANY KIND, either express or implied.
    See the License for the specific language governing permissions and
    limitations under the License.

-->
<!DOCTYPE configuration SYSTEM "generator.dtd"[
	<!ENTITY controls_xml SYSTEM "controls.xml">
	<!ENTITY fields_xml SYSTEM "fields.xml">
]>
<configuration>
	<format>
		<date>
			<pattern>dd.MM.yyyy</pattern>
			<locale>
				<language>de</language>
				<country>de</country>
			</locale>
		</date>
		<number>
			<pattern>0.00</pattern>
			<locale>
				<language>en</language>
				<country>US</country>
			</locale>
		</number>
	</format>
	<charsets>
		<charset id="iso-8859-1">
			<encoding>iso-8859-1</encoding>
			<good_expression>[^\x00-\x1F\x7F\x80-\x9F]</good_expression>
			<bad_expression>[[^\x00-\x1F\x7F\x80-\x9F\s][ ]]</bad_expression>
		</charset>
	</charsets>
	&controls_xml;
	&fields_xml;
	<constraints charset_id="iso-8859-1">
		<constraint id="google.all" class="Complex">
			<constraint id="google.searchTerm">
				<field_ref id="searchTerms"/>
			</constraint>
			<constraint id="google.languageId">
				<field_ref id="languageIds"/>
			</constraint>
			<constraint id="google.countryId">
				<field_ref id="countryIds"/>
			</constraint>
		</constraint>
	</constraints>
</configuration>
